{
  "dataset_id": "OX-SINICA1241",
  "version": "0.2.0",
  "title": "論發冷小腸疝兩症",
  "quality": "全10幅原印文字層完成來源先讀的獨立AI視讀、逐單位比較與回圖處置；保留3個疑字及2處刻點位置未解。未經人類雙校、專家審定或同儕審查。",
  "source": {
    "object_url": "https://digital.bodleian.ox.ac.uk/objects/3a397e45-295b-4a9c-a8a5-1b2db808b2b0/",
    "manifest_url": "https://iiif.bodleian.ox.ac.uk/iiif/manifest/3a397e45-295b-4a9c-a8a5-1b2db808b2b0.json",
    "shelfmark": "Bodleian Library Sinica 1241",
    "edition": "咸豐九年（1859）博濟醫局刊本；廣州地點依書目。",
    "author_attribution": "Serica 書目歸於 J. G. Kerr（嘉約翰，1824–1901）；卷首未見作者署名。"
  },
  "methods": {
    "initial_image_reading": "Gemini gemini-3.8-flash-high，兩個分開範圍的影像初錄工作；主代理全幅版式檢查及原印層範圍整理。",
    "independent_image_collation": "獨立Codex GPT-6工作先讀全部10幅固定影像，未見初錄；封存讀字後才比較全108初錄單位、15初錄疑讀及高風險項，並以同源4000px圖回看分歧。",
    "human_double_collation": "not-run",
    "expert_review": "not-run",
    "peer_review": "not-run",
    "punctuation": "原刻點形以頓號編碼；不將數位標點形狀等同原刻點形。",
    "detailed_workflow_public": false,
    "private_witnesses_and_guard_audit_preserved": true,
    "independent_reader_model_disclosure": "工作以gpt-6-astra/ultra設定請求；讀者上下文僅能確認GPT-6（Codex），未取得更細的實際模型回報，故不以設定冒充實際型號證明。",
    "comparison_result": "39欄刻點專項回看中37已裁定、2已回圖未解、0尚未查；全部版式與原印層均有比較記錄。",
    "controller_source_review": "主代理回看題名與刊字、宗教前言異讀、醫學正文實字分歧、量詞小註、所有新增葉碼及未解點形的來源；依圖採納修訂，保留無法定讀。"
  },
  "position_convention": "疑字start/end為Unicode碼點0起算半開區間[start,end)；刻點缺席的疑讀用相鄰實字作錨，不代表該字未識。小註掛接的0起算字串邊界見CORRECTIONS.json。",
  "metrics": {
    "canvases": 10,
    "visible_book_surfaces": 18,
    "original_printed_faces": 12,
    "units": 116,
    "codepoints": 1689,
    "uncertainty_records": 5,
    "square_placeholders": 3,
    "changed_or_added_units": 47
  },
  "pages": [
    {
      "page_id": "c01",
      "index": 1,
      "width": 2200,
      "height": 2025,
      "official_label": "Upper cover",
      "canvas_id": "https://iiif.bodleian.ox.ac.uk/iiif/canvas/e9e2221c-a42e-4291-95ef-0f389f4dfe35.json",
      "image_url": "https://iiif.bodleian.ox.ac.uk/iiif/image/e9e2221c-a42e-4291-95ef-0f389f4dfe35/full/2200,/0/default.jpg",
      "source_sha256": "a4b03ca6d61ace846102f6c5327762444bcfcf02b03673e11cd9cb1fe78b9d49",
      "layout_note": "全幅為前封面與攝影尺卡；封面只有後加英文展覽紙標、手寫編號／館藏號，未見可屬本書原刊的印字。",
      "layout_reviewed": true,
      "layer_states": {},
      "units": [],
      "uncertainties": []
    },
    {
      "page_id": "c02",
      "index": 2,
      "width": 2200,
      "height": 2025,
      "official_label": "Inside upper cover and p. [1]",
      "canvas_id": "https://iiif.bodleian.ox.ac.uk/iiif/canvas/249b5727-15cb-4406-8ab8-9439ed30021d.json",
      "image_url": "https://iiif.bodleian.ox.ac.uk/iiif/image/249b5727-15cb-4406-8ab8-9439ed30021d/full/2200,/0/default.jpg",
      "source_sha256": "444906991f191ab0e8b747b4b7bad9e81f4f2adcc03916407589aee1c7b865ce",
      "layout_note": "右面為無原刊字的內封，左面為三直欄牌記式封面；按左面右欄、中央大字、左欄讀。上方英文手寫及下方1859手寫均排除。",
      "layout_reviewed": true,
      "layer_states": {
        "original-print": "reviewed"
      },
      "units": [
        {
          "id": "c02-L01",
          "layer": "original-print",
          "role": "title",
          "side": "left",
          "text": "咸豐九年新鍥",
          "bbox": null
        },
        {
          "id": "c02-L02",
          "layer": "original-print",
          "role": "title",
          "side": "left",
          "text": "論發冷小腸疝兩症",
          "bbox": null
        },
        {
          "id": "c02-L03",
          "layer": "original-print",
          "role": "title",
          "side": "left",
          "text": "博濟醫局藏板",
          "bbox": null
        }
      ],
      "uncertainties": []
    },
    {
      "page_id": "c03",
      "index": 3,
      "width": 2200,
      "height": 2025,
      "official_label": "pp. [2]-[3]",
      "canvas_id": "https://iiif.bodleian.ox.ac.uk/iiif/canvas/d1e8b916-8bb7-4574-aeb5-50094cafa5ae.json",
      "image_url": "https://iiif.bodleian.ox.ac.uk/iiif/image/d1e8b916-8bb7-4574-aeb5-50094cafa5ae/full/2200,/0/default.jpg",
      "source_sha256": "27a4730db820095c44c51b3dd0241a803101c9b5b07bc936db00d55d8db1f961",
      "layout_note": "右面是封面字樣的反向透印，未見本面新印文字；右下館藏章排除。左面九個直欄為序文，外側版心可辨魚尾與葉碼一。按左面右至左逐欄錄。",
      "layout_reviewed": true,
      "layer_states": {
        "original-print": "reviewed-with-unresolved-readings"
      },
      "units": [
        {
          "id": "c03-L01",
          "layer": "original-print",
          "role": "preface",
          "side": "left",
          "text": "嘗□天道福善禍淫、疾病死亡、所以報惡",
          "bbox": null
        },
        {
          "id": "c03-L02",
          "layer": "original-print",
          "role": "preface",
          "side": "left",
          "text": "者也、初、天地闢時、亞當夏娃二人違",
          "bbox": null
        },
        {
          "id": "c03-L03",
          "layer": "original-print",
          "role": "preface",
          "side": "left",
          "text": "天父命、食禁果、罪惡由此始、厥後苗裔、因",
          "bbox": null
        },
        {
          "id": "c03-L04",
          "layer": "original-print",
          "role": "preface",
          "side": "left",
          "text": "有罪惡、既有罪惡、當受懲罰、　　天父特",
          "bbox": null
        },
        {
          "id": "c03-L05",
          "layer": "original-print",
          "role": "preface",
          "side": "left",
          "text": "降以死亡疾病、懲惡罰罪、使人悔改、此意",
          "bbox": null
        },
        {
          "id": "c03-L06",
          "layer": "original-print",
          "role": "preface",
          "side": "left",
          "text": "非無足據、昔保羅曰、且以一人在世有罪、",
          "bbox": null
        },
        {
          "id": "c03-L07",
          "layer": "original-print",
          "role": "preface",
          "side": "left",
          "text": "因罪而死、又曰、罪惡之償値、亡死、蓋禍難",
          "bbox": null
        },
        {
          "id": "c03-L08",
          "layer": "original-print",
          "role": "preface",
          "side": "left",
          "text": "由於罪惡、然罪惡之報、不徒在於今生、更",
          "bbox": null
        },
        {
          "id": "c03-L09",
          "layer": "original-print",
          "role": "preface",
          "side": "left",
          "text": "在於世界末日、故見人有禍難、在己貴以",
          "bbox": null
        },
        {
          "id": "c03-L-folio-v020",
          "layer": "original-print",
          "role": "folio",
          "side": "left",
          "text": "一",
          "bbox": null
        }
      ],
      "uncertainties": [
        {
          "id": "c03-v020-unc-1",
          "unit_id": "c03-L01",
          "start": 1,
          "end": 2,
          "surface": "□",
          "candidates": [
            "思",
            "聞"
          ],
          "reason": "紙面剝落未恢復，hi-c03仍不能定內部筆畫；僅此一字待定。",
          "cause": "source-illegible",
          "extent": "known",
          "note": "已回圖未解；單字或刻點位置已定位。"
        },
        {
          "id": "c03-v020-point-01",
          "unit_id": "c03-L01",
          "start": 8,
          "end": 9,
          "surface": "、",
          "candidates": [
            "、",
            "無刻點"
          ],
          "reason": "淫右下短黑痕緊接版框，高解析回圖仍不能確定獨立刻點或邊框黏墨；暫保留初錄刻點。",
          "cause": "point-shape-unresolved",
          "extent": "known",
          "note": "已回圖未解；單字或刻點位置已定位。"
        }
      ]
    },
    {
      "page_id": "c04",
      "index": 4,
      "width": 2200,
      "height": 2025,
      "official_label": "pp. [4]-[5]",
      "canvas_id": "https://iiif.bodleian.ox.ac.uk/iiif/canvas/c498aa5c-3700-4e1d-b586-7d7fb06ad0a2.json",
      "image_url": "https://iiif.bodleian.ox.ac.uk/iiif/image/c498aa5c-3700-4e1d-b586-7d7fb06ad0a2/full/2200,/0/default.jpg",
      "source_sha256": "441cbb1103454b55526081f84e0e9b905e4bf2c8139061ceaf1643ce95a1c17f",
      "layout_note": "兩面接續序文，右面九欄、左面七欄；兩個外側版心分別見魚尾和葉碼一、二。天父前的空格及抬敬以版式註記保存，不增添標點。",
      "layout_reviewed": true,
      "layer_states": {
        "original-print": "reviewed-with-unresolved-readings"
      },
      "units": [
        {
          "id": "c04-R01",
          "layer": "original-print",
          "role": "preface",
          "side": "right",
          "text": "死亡自省、昔耶穌誨耶路撒冷人曰、爾曹",
          "bbox": null
        },
        {
          "id": "c04-R02",
          "layer": "original-print",
          "role": "preface",
          "side": "right",
          "text": "不悔改、亦必死亡、可見惡必受罰、當悔改",
          "bbox": null
        },
        {
          "id": "c04-R03",
          "layer": "original-print",
          "role": "preface",
          "side": "right",
          "text": "求免、況死後永苦、比生前重罰尤慘、勿謂",
          "bbox": null
        },
        {
          "id": "c04-R04",
          "layer": "original-print",
          "role": "preface",
          "side": "right",
          "text": "天堂地獄之說爲無稽也、近世風俗人心、",
          "bbox": null
        },
        {
          "id": "c04-R05",
          "layer": "original-print",
          "role": "preface",
          "side": "right",
          "text": "愈降愈下、故兵燹、水旱、瘟疫、疾病、無地無",
          "bbox": null
        },
        {
          "id": "c04-R06",
          "layer": "original-print",
          "role": "preface",
          "side": "right",
          "text": "之、諸禍中、恒多者惟疾病、顯見者亦惟疾",
          "bbox": null
        },
        {
          "id": "c04-R07",
          "layer": "original-print",
          "role": "preface",
          "side": "right",
          "text": "病、如貪花柳者有疳疔痳瘋患、飲酒食洋",
          "bbox": null
        },
        {
          "id": "c04-R08",
          "layer": "original-print",
          "role": "preface",
          "side": "right",
          "text": "烟者、有損身致病患、好勇□狠者、有刀傷",
          "bbox": null
        },
        {
          "id": "c04-R09",
          "layer": "original-print",
          "role": "preface",
          "side": "right",
          "text": "患、此種病患、皆罪所當得、外此百般病患、",
          "bbox": null
        },
        {
          "id": "c04-L01",
          "layer": "original-print",
          "role": "preface",
          "side": "left",
          "text": "雖良民亦有不免者、推其原皆因初世犯",
          "bbox": null
        },
        {
          "id": "c04-L02",
          "layer": "original-print",